{
  "$schema": "http://json-schema.org/draft-07/schema#",
  "$id": "https://tokenoftrust.com/storefront-devkit/schemas/theme.schema.json",
  "title": "ToT Storefront theme.json",
  "description": "Brand look for a tenant. A deep-partial override merged over the platform reference theme — set only what you want to change. Every value below maps to a CSS custom property the shared component library reads (e.g. color.primary -> --color-primary). Validated for known tokens + WCAG AA contrast at publish (text pairs error, muted warns).",
  "type": "object",
  "additionalProperties": false,
  "patternProperties": { "^[_$]": { "description": "Doc/meta keys ($schema, _note) — ignored by the platform." } },
  "properties": {
    "color": {
      "type": "object",
      "description": "Color tokens. The core palette is expected for a complete theme; the semantic/state tokens are optional and fall back to platform-derived defaults.",
      "additionalProperties": false,
      "properties": {
        "bg": { "$ref": "#/definitions/color", "description": "Page background" },
        "surface": { "$ref": "#/definitions/color", "description": "Raised card/panel surface" },
        "text": { "$ref": "#/definitions/color", "description": "Primary body + heading text" },
        "muted": { "$ref": "#/definitions/color", "description": "Secondary / caption text" },
        "primary": { "$ref": "#/definitions/color", "description": "Brand anchor — primary CTAs, active nav, hero fill" },
        "primary-contrast": { "$ref": "#/definitions/color", "description": "Readable text/icon color ON primary" },
        "accent": { "$ref": "#/definitions/color", "description": "Single brand spark — badges, marks, large accent type" },
        "border": { "$ref": "#/definitions/color", "description": "Hairline borders, dividers, input outlines" },
        "success": { "$ref": "#/definitions/color", "description": "Success / in-stock / savings" },
        "sale": { "$ref": "#/definitions/color", "description": "Sale / markdown price emphasis" },
        "surface-2": { "$ref": "#/definitions/color", "description": "Subtle inset fill between bg and surface" },
        "warning": { "$ref": "#/definitions/color", "description": "Warning / low-stock state" },
        "error": { "$ref": "#/definitions/color", "description": "Error / out-of-stock / destructive" },
        "info": { "$ref": "#/definitions/color", "description": "Informational (notices, help)" },
        "accent-ink": { "$ref": "#/definitions/color", "description": "Accent tuned for small text/links on light surfaces (AA). Derived from accent if omitted." },
        "primary-hover": { "$ref": "#/definitions/color", "description": "Hover/active shade of primary. Derived if omitted." },
        "accent-hover": { "$ref": "#/definitions/color", "description": "Hover/active shade of accent. Derived if omitted." },
        "focus-ring": { "$ref": "#/definitions/color", "description": "Keyboard focus outline. Defaults to accent." },
        "disabled": { "$ref": "#/definitions/color", "description": "Disabled/loading control fill. Derived if omitted." },
        "disabled-contrast": { "$ref": "#/definitions/color", "description": "Text/icon on a disabled control. Defaults to muted." },
        "field-border": { "$ref": "#/definitions/color", "description": "Form-field outline (stronger than border). Derived if omitted." },
        "star": { "$ref": "#/definitions/color", "description": "Review/rating star fill. Defaults to accent." },
        "cta": { "$ref": "#/definitions/color", "description": "Primary call-to-action fill (buy button, hero CTA). Defaults to primary." },
        "cta-hover": { "$ref": "#/definitions/color", "description": "Hover/active shade of cta. Defaults to primary-hover." },
        "cta-contrast": { "$ref": "#/definitions/color", "description": "Text/icon on cta. Defaults to primary-contrast." },
        "trust": { "$ref": "#/definitions/color", "description": "Trust/reassurance accent (guarantees, compliance badges). Defaults to success." },
        "hero-eyebrow": { "$ref": "#/definitions/color", "description": "Home hero eyebrow text. Defaults to muted on a light hero, a translucent primary-contrast on a bold hero." }
      }
    },
    "type": {
      "type": "object",
      "description": "Typography tokens.",
      "additionalProperties": false,
      "properties": {
        "display": { "$ref": "#/definitions/fontFace", "description": "Display / headline family" },
        "body": { "$ref": "#/definitions/fontFace", "description": "Body copy family" },
        "mono": { "$ref": "#/definitions/fontFace", "description": "Monospace family" },
        "scale": { "type": "number", "description": "Modular type scale ratio (e.g. 1.25 = major third)" },
        "tracking": { "type": "string", "description": "Base letter-spacing (e.g. \"-0.011em\")" },
        "headings": {
          "type": "object",
          "description": "Fixed heading sizes. Each set level replaces the fluid display-scale size: hero sizes the home hero headline; h1/h2/h3 size every other heading of that level (page and listing titles, block titles, headings in page body copy). Unset levels keep the fluid scale. Use to match a source site's heading sizes.",
          "additionalProperties": false,
          "properties": {
            "hero": { "$ref": "#/definitions/cssSize" },
            "h1": { "$ref": "#/definitions/cssSize" },
            "h2": { "$ref": "#/definitions/cssSize" },
            "h3": { "$ref": "#/definitions/cssSize" }
          }
        }
      }
    },
    "space": {
      "type": "object",
      "additionalProperties": false,
      "properties": {
        "base": { "type": "number", "description": "Base spacing unit in px (e.g. 4)" },
        "scale": { "type": "array", "items": { "type": "number" }, "description": "Spacing scale steps" },
        "containerMaxWidth": { "type": "string", "description": "Max content width (e.g. \"1240px\")" },
        "sectionRhythm": { "type": "string", "description": "Vertical rhythm between sections (e.g. a clamp())" }
      }
    },
    "shape": {
      "type": "object",
      "additionalProperties": false,
      "properties": {
        "radius": {
          "type": "object",
          "additionalProperties": false,
          "properties": {
            "sm": { "type": "string" },
            "md": { "type": "string" },
            "lg": { "type": "string" },
            "full": { "type": "string" }
          }
        },
        "borderWeights": {
          "type": "object",
          "additionalProperties": false,
          "properties": {
            "thin": { "type": "string" },
            "medium": { "type": "string" },
            "thick": { "type": "string" }
          }
        },
        "shadow": {
          "type": "object",
          "additionalProperties": false,
          "properties": {
            "sm": { "type": "string" },
            "md": { "type": "string" },
            "lg": { "type": "string" }
          }
        },
        "tapTarget": { "type": "string", "description": "Minimum interactive tap-target size (e.g. \"44px\"). Defaults to 44px." }
      }
    },
    "brand": {
      "type": "object",
      "additionalProperties": false,
      "properties": {
        "logoLight": { "type": "string", "description": "Path under public/** to the light-mode logo" },
        "logoDark": { "type": "string", "description": "Path under public/** to the dark-mode logo" },
        "favicon": { "type": "string" },
        "ogImage": { "type": "string", "description": "Default Open Graph share image" },
        "motion": { "type": "string", "enum": ["full", "reduced"], "description": "Motion preference default" },
        "headerVariant": { "type": "string", "enum": ["light", "dark"], "description": "Header bar: light (default) or dark (primary-colour bar with the light logo)" },
        "heroVariant": { "type": "string", "enum": ["bold", "light", "banner"], "description": "Home hero treatment: bold (default — full-bleed primary background, light text), light (page background, brand colour on headline and CTA), banner (the hero image edge-to-edge, for source artwork that already carries the copy)" }
      }
    }
  },
  "definitions": {
    "color": {
      "type": "string",
      "description": "A CSS color — hex recommended (e.g. \"#1F3A34\").",
      "pattern": "^(#([0-9a-fA-F]{3}|[0-9a-fA-F]{6}|[0-9a-fA-F]{8})|rgb\\(.*\\)|rgba\\(.*\\)|hsl\\(.*\\)|hsla\\(.*\\)|color-mix\\(.*\\)|var\\(.*\\))$"
    },
    "cssSize": {
      "type": "string",
      "description": "A CSS length or math function over lengths, e.g. \"28px\", \"1.75rem\", \"clamp(1.5rem, 4vw, 2rem)\".",
      "maxLength": 120,
      "pattern": "^[0-9a-zA-Z.%(),+\\-*/ ]*[0-9a-zA-Z%)]$"
    },
    "fontFace": {
      "type": "object",
      "additionalProperties": false,
      "properties": {
        "family": { "type": "string", "description": "Font family name" },
        "weights": { "type": "array", "items": { "type": "number" }, "description": "Weights to load" }
      },
      "required": ["family"]
    }
  }
}
